{
  "name": "OMP Hud",
  "author": "OMP",
  "contributors": [
    "Hypnotize"
  ],
  "social": {
    "steam_group": "tf2hud",
    "album": "https://imgur.com/a/mCoYj"
  },
  "repo": "https://github.com/Hypnootize/OMP-Hud",
  "hash": "e051158f22ba1be5343eb9765451a037c8460589",
  "resources": [
    "omp-hud-banner"
  ]
}