{
  "name": "m0rehud",
  "author": "Hypnotize",
  "social": {
    "steam_profile": "76561198058754493",
    "album": "https://imgur.com/a/sxOyM"
  },
  "flags": [
    "fonts",
    "menus",
    "scoreboards",
    "crosshairs",
    "minmode",
    "materials",
    "customization"
  ],
  "traits": {
    "os": [
      "windows",
      "linux"
    ],
    "gamemode": [
      "tournament",
      "comp",
      "arena",
      "ad",
      "ctf",
      "cp",
      "halloween",
      "koth",
      "mannpower",
      "mvm",
      "pass",
      "pl",
      "plr",
      "pd",
      "rd",
      "sd",
      "tc"
    ],
    "res": [
      "4/3",
      "5/4",
      "16/9",
      "16/10"
    ],
    "position": [
      "center"
    ],
    "lang": [
      "en"
    ]
  },
  "repo": "https://github.com/Hypnootize/m0rehud",
  "hash": "996ade6b5abafe5f160cddef6d26057162516470",
  "resources": [
    "m0rehud-banner",
    "m0rehud-menu",
    "m0rehud-buff",
    "m0rehud-low",
    "m0rehud-minmode",
    "m0rehud-medic",
    "m0rehud-win",
    "m0rehud-scoreboard",
    "m0rehud-spectator"
  ]
}
