{
  "name": "Hudas Iscariote",
  "author": "Hypnotize, Quartz & Sir Villeta",
  "social": {
    "steam_group": "KinevoNetwork",
    "album": "https://imgur.com/a/ag9He"
  },
  "repo": "https://github.com/Hypnootize/Hudas-Iscariote",
  "hash": "57819f4852eeba9043d03870b5d5acd94ad29d47",
  "resources": [
    "hudas-iscariote-banner"
  ]
}