{
  "name": "Center HUD",
  "author": "Eerorri",
  "releaseDate": "2023-12-23",
  "flags": [
    "fonts",
    "menus",
    "crosshairs",
    "minmode",
    "materials",
    "customization"
  ],
  "tags": ["vanilla", "default"],
  "repo": "https://github.com/Eerorri/center-hud",
  "hash": "9b7f760673449da5d582092acb2f9138b598dbcd",
  "prerelease": false,
  "resources": [
    "centerlogo",
    "center1",
    "center2",
    "center3",
    "center4",
    "center5",
    "https://youtu.be/a_38tTV4Xhc",
    "https://youtu.be/G39x7-gmCzU"
  ],
  "social": {
    "steam_profile": "76561199001745671",
    "twitter": "Eerorri_"
  },
  "traits": {
    "os": ["windows", "linux"],
    "gamemode": [
      "tournament",
      "comp",
      "arena",
      "ad",
      "ctf",
      "cp",
      "halloween",
      "koth",
      "mannpower",
      "mvm",
      "pass",
      "pl",
      "plr",
      "pd",
      "rd",
      "sd",
      "tc"
    ],
    "res": ["4/3", "16/9", "21/9"],
    "position": ["center"]
  }
}
