{
  "name": "Community HUD Fixes",
  "author": "CriticalFlaw",
  "social": {
    "support": "https://github.com/sponsors/CriticalFlaw",
    "steam_profile": "76561198041892999",
    "twitter": "CriticalFlaw_",
    "discord": "hTdtK9vBhE",
    "youtube": "@CriticalFlaw"
  },
  "flags": [
    "crosshairs",
    "minmode",
    "materials",
    "customization"
  ],
  "traits": {
    "os": ["windows", "mac", "linux"],
    "gamemode": [
      "tournament",
      "comp",
      "arena",
      "ad",
      "ctf",
      "cp",
      "halloween",
      "koth",
      "mannpower",
      "mvm",
      "pass",
      "pl",
      "plr",
      "pd",
      "rd",
      "sd",
      "tc"
    ],
    "res": ["1/1", "4/3", "5/4", "16/10", "16/9", "17/9", "21/9", "32/9"],
    "position": ["default"],
    "lang": ["en"]
  },
  "tags": ["default"],
  "repo": "https://github.com/CriticalFlaw/TF2HUD.Fixes",
  "hash": "eabd28aa5d2436b45eb78f0bf61b33a96c018db3",
  "verified": true,
  "resources": [
    "banner"
  ]
}
