{
  "name": "Broesel Hud",
  "author": "Broesel",
  "contributors": [
    "Hypnotize"
  ],
  "social": {
    "steam_group": "broeselhud",
    "album": "https://imgur.com/a/YxG82"
  },
  "repo": "https://github.com/Hypnootize/Broesel-Hud",
  "hash": "ed6b267afcb93cedb114822d1268cfb0f0b148a3",
  "resources": [
    "broesel-hud-banner"
  ]
}