{
  "name": "deliHUD Neue",
  "author": "Deli",
  "social": {
    "steam_group": "deliHUD",
    "album": "https://imgur.com/a/ix8g52d"
  },
  "repo": "https://github.com/delegacz/deliHUDNeue",
  "hash": "37abc07a018e00abf9dd8989790523c22f08f858",
  "parent": "deli-hud",
  "resources": [
    "delihud-neue-banner"
  ]
}