{
  "name": "Broesel Old",
  "author": "Hypnotize, Broesel",
  "social": {
    "steam_group": "broeselhud",
    "album": "https://imgur.com/a/fG2xQ"
  },
  "repo": "https://github.com/Hypnootize/Broesel-Old",
  "hash": "ef087df34fffab7cfd62ac9ab2a8506b441f37d0",
  "parent": "broesel-hud",
  "resources": [
    "broesel-old-banner"
  ]
}