{
  "name": "TF2 Recording HUD",
  "author": "Hypnotize",
  "social": {
    "steam_profile": "76561198058754493",
    "album": "https://imgur.com/a/PuONMo7"
  },
  "repo": "https://github.com/Hypnootize/TF2-Recording-HUD",
  "hash": "68b1912d8edbadfaa144f25b870bb1f45d0ec649",
  "resources": ["tf2-recording-hud-banner"]
}
