{
  "name": "Mini Hud",
  "author": "Unknown",
  "contributors": [
    "techno"
  ],
  "social": {
    "album": "https://imgur.com/a/YqeYDu5"
  },
  "repo": "https://github.com/TechnoSL/Mini-Hud",
  "hash": "4c082b4bd4860a64303a07719e3260ee35def9cd",
  "parent": "",
  "resources": [
    "minihud-menu",
    "minihud-loadout",
    "minihud-gameplay"
  ]
}
