{
  "name": "cibahud",
  "author": "CibaCity",
  "social": {
    "steam_group": "cibascity",
    "album": "https://imgur.com/a/OoX4yAz"
  },
  "flags": [
    "fonts",
    "menus",
    "scoreboards",
    "crosshairs",
    "minmode",
    "materials"
  ],
  "traits": {
    "os": ["windows"],
    "gamemode": [
      "tournament",
      "comp",
      "arena",
      "ad",
      "ctf",
      "cp",
      "halloween",
      "koth",
      "mannpower",
      "mvm",
      "pl",
      "plr",
      "pd",
      "rd",
      "sd",
      "tc"
    ],
    "res": ["4/3", "5/4", "16/9", "16/10"]
  },
  "repo": "https://github.com/CibaCity/cibahud",
  "hash": "9738f77676bb1b486e64a4d256ffd22388ad7abb",
  "resources": ["ciba-hud-banner"]
}
