{
  "name": "voidHUD Classic",
  "author": "static",
  "social": {
    "steam_group": "voidhud",
    "discord": "https://discord.com/invite/NtQ3FsT",
    "album": "https://imgur.com/a/BKWgR"
  },
  "repo": "https://github.com/TheStaticVoid/VoidHUD2.0",
  "hash": "8165dbad858243a90ec7c8a35ea6bd701f5738e1",
  "parent": "void-hud-2.0",
  "resources": [
    "voidhud-classic-banner",
    "image00",
    "image01",
    "image02",
    "image03",
    "image04",
    "image05",
    "image06"
  ]
}