{
  "name": "Broesel Crsp",
  "author": "Hypnotize, extracrispy",
  "social": {
    "album": "https://imgur.com/a/Ywblk"
  },
  "repo": "https://github.com/Hypnootize/Crsp-Broesel",
  "hash": "670670ccef8726aadfde8dc186da90bcf866dc87",
  "parent": "broesel-hud",
  "resources": [
    "broesel-crsp-banner"
  ]
}