{
  "name": "InsomniaHUD",
  "author": "Lead",
  "social": {
    "album": "https://github.com/p3tr1ch0r/insomniaHUD#screenshots",
    "steam_profile": "https://steamcommunity.com/profiles/76561199066986123"
  },
  "flags": [
    "fonts",
    "menus",
    "scoreboards",
    "crosshairs",
    "materials",
    "customization"
  ],
  "traits": {
    "os": [
      "windows"
    ],
    "gamemode": [
      "ad",
      "ctf",
      "cp",
      "koth",
      "mannpower",
      "pl",
      "plr",
      "sd",
      "tc"
    ],
    "res": [
      "4/3",
      "16/9",
      "16/10",
      "21/9",
      "32/9"
    ],
    "position": [
      "center"
    ],
    "lang": [
      "en"
    ]
  },
  "tags": [
    "minimal",
    "monochrome",
    "customizable"
  ],
  "repo": "https://github.com/p3tr1ch0r/insomniaHUD",
  "hash": "f876f002e59df7a34b40f73e6b0d6ab4bd3aa4f9",
  "prerelease": true,
  "resources": [
    "insomniahud-banner",
    "main_menu",
    "main_menu_ingame",
    "customization_menu",
    "items_menu",
    "backpack",
    "class_loadout",
    "team_menu",
    "class_menu",
    "payload",
    "attack_defend",
    "control_points",
    "koth",
    "ctf"
  ]
}