{
  "name": "mkhud",
  "author": "kmarcie",
  "social": {
    "steam_group": "mkhud",
    "album": "https://imgur.com/a/wHHbv"
  },
  "flags": [
    "fonts",
    "menus",
    "scoreboards",
    "crosshairs",
    "materials",
    "customization"
  ],
  "traits": {
    "os": [
      "windows",
      "linux"
    ],
    "gamemode": [
      "tournament",
      "comp",
      "arena",
      "ad",
      "ctf",
      "cp",
      "halloween",
      "koth",
      "mannpower",
      "mvm",
      "pass",
      "pl",
      "plr",
      "pd",
      "rd",
      "sd",
      "tc"
    ],
    "res": [
      "4/3",
      "5/4",
      "16/9",
      "16/10"
    ]
  },
  "repo": "https://github.com/kmarcie/mkHUD",
  "hash": "0e08677b70e77c4f4fc0265578401e61b1c6abed",
  "resources": [
    "mk-hud-banner"
  ]
}
